[
  {
    "event_id": "query-trip-153671052974046625|20180912000209|IND583101AAA>IND583201AAA",
    "kind": "query",
    "event_time": "2018-09-12T00:02:09.740725",
    "corridor_id": "IND583101AAA>IND583201AAA",
    "source_center": "IND583101AAA",
    "destination_center": "IND583201AAA",
    "trip_uuid": "trip-153671052974046625",
    "leg_id": "trip-153671052974046625|20180912000209|IND583101AAA>IND583201AAA",
    "route_type": "FTL",
    "planned_min": 46.0,
    "planned_km": 63.6461,
    "created_hour": 0,
    "created_dayofweek": 4,
    "created_is_weekend": 0
  },
  {
    "event_id": "query-trip-153671121411074590|20180912105014|IND515004AAA>IND562132AAA",
    "kind": "query",
    "event_time": "2018-09-12T00:13:34.111131",
    "corridor_id": "IND515004AAA>IND562132AAA",
    "source_center": "IND515004AAA",
    "destination_center": "IND562132AAA",
    "trip_uuid": "trip-153671121411074590",
    "leg_id": "trip-153671121411074590|20180912105014|IND515004AAA>IND562132AAA",
    "route_type": "FTL",
    "planned_min": 184.0,
    "planned_km": 203.6756,
    "created_hour": 0,
    "created_dayofweek": 4,
    "created_is_weekend": 0
  },
  {
    "event_id": "query-trip-153671191949943656|20180912043309|IND487001AAB>IND487551AAA",
    "kind": "query",
    "event_time": "2018-09-12T00:25:19.499696",
    "corridor_id": "IND487001AAB>IND487551AAA",
    "source_center": "IND487001AAB",
    "destination_center": "IND487551AAA",
    "trip_uuid": "trip-153671191949943656",
    "leg_id": "trip-153671191949943656|20180912043309|IND487001AAB>IND487551AAA",
    "route_type": "FTL",
    "planned_min": 42.0,
    "planned_km": 48.4129,
    "created_hour": 0,
    "created_dayofweek": 4,
    "created_is_weekend": 0
  },
  {
    "event_id": "query-trip-153671387315368041|20180912005753|IND151001AAA>IND148101AAA",
    "kind": "query",
    "event_time": "2018-09-12T00:57:53.153952",
    "corridor_id": "IND151001AAA>IND148101AAA",
    "source_center": "IND151001AAA",
    "destination_center": "IND148101AAA",
    "trip_uuid": "trip-153671387315368041",
    "leg_id": "trip-153671387315368041|20180912005753|IND151001AAA>IND148101AAA",
    "route_type": "FTL",
    "planned_min": 62.0,
    "planned_km": 66.039,
    "created_hour": 0,
    "created_dayofweek": 4,
    "created_is_weekend": 0
  },
  {
    "event_id": "query-trip-153671402673350359|20180912020304|IND574211AAA>IND574202AAA",
    "kind": "query",
    "event_time": "2018-09-12T01:00:26.733769",
    "corridor_id": "IND574211AAA>IND574202AAA",
    "source_center": "IND574211AAA",
    "destination_center": "IND574202AAA",
    "trip_uuid": "trip-153671402673350359",
    "leg_id": "trip-153671402673350359|20180912020304|IND574211AAA>IND574202AAA",
    "route_type": "FTL",
    "planned_min": 18.0,
    "planned_km": 25.2975,
    "created_hour": 1,
    "created_dayofweek": 4,
    "created_is_weekend": 0
  },
  {
    "event_id": "fact-trip-153671052974046625|20180912000209|IND583101AAA>IND583201AAA",
    "kind": "fact",
    "event_time": "2018-09-12T02:29:09",
    "corridor_id": "IND583101AAA>IND583201AAA",
    "source_center": "IND583101AAA",
    "destination_center": "IND583201AAA",
    "trip_uuid": "trip-153671052974046625",
    "leg_id": "trip-153671052974046625|20180912000209|IND583101AAA>IND583201AAA",
    "gap_min": 101.0,
    "log_gap_ratio": 1.1617911902896414,
    "is_delayed": 1
  },
  {
    "event_id": "fact-trip-153671387315368041|20180912005753|IND151001AAA>IND148101AAA",
    "kind": "fact",
    "event_time": "2018-09-12T02:53:53",
    "corridor_id": "IND151001AAA>IND148101AAA",
    "source_center": "IND151001AAA",
    "destination_center": "IND148101AAA",
    "trip_uuid": "trip-153671387315368041",
    "leg_id": "trip-153671387315368041|20180912005753|IND151001AAA>IND148101AAA",
    "gap_min": 54.0,
    "log_gap_ratio": 0.626455806061273,
    "is_delayed": 1
  },
  {
    "event_id": "fact-trip-153671402673350359|20180912020304|IND574211AAA>IND574202AAA",
    "kind": "fact",
    "event_time": "2018-09-12T02:58:04",
    "corridor_id": "IND574211AAA>IND574202AAA",
    "source_center": "IND574211AAA",
    "destination_center": "IND574202AAA",
    "trip_uuid": "trip-153671402673350359",
    "leg_id": "trip-153671402673350359|20180912020304|IND574211AAA>IND574202AAA",
    "gap_min": 37.0,
    "log_gap_ratio": 1.1169614273363062,
    "is_delayed": 1
  },
  {
    "event_id": "fact-trip-153671191949943656|20180912043309|IND487001AAB>IND487551AAA",
    "kind": "fact",
    "event_time": "2018-09-12T05:51:09",
    "corridor_id": "IND487001AAB>IND487551AAA",
    "source_center": "IND487001AAB",
    "destination_center": "IND487551AAA",
    "trip_uuid": "trip-153671191949943656",
    "leg_id": "trip-153671191949943656|20180912043309|IND487001AAB>IND487551AAA",
    "gap_min": 36.0,
    "log_gap_ratio": 0.6190392084062235,
    "is_delayed": 1
  },
  {
    "event_id": "fact-trip-153671121411074590|20180912105014|IND515004AAA>IND562132AAA",
    "kind": "fact",
    "event_time": "2018-09-12T16:29:14",
    "corridor_id": "IND515004AAA>IND562132AAA",
    "source_center": "IND515004AAA",
    "destination_center": "IND562132AAA",
    "trip_uuid": "trip-153671121411074590",
    "leg_id": "trip-153671121411074590|20180912105014|IND515004AAA>IND562132AAA",
    "gap_min": 155.0,
    "log_gap_ratio": 0.6110643497714647,
    "is_delayed": 1
  }
]